{
  "schemaVersion": "0.1.0",
  "kind": "handoff_packet",
  "packetId": "PKT-SA01-MOG-20260712-FAIL2",
  "atomTrailId": "ATOM-MOG-SA01-PACKMOGWORD-INJ-20260712",
  "timestamp": "2026-07-12T10:00:00+10:00",
  "contextRef": "negative vector for dependentRequired check",
  "checkpoint": null,
  "issuer": {
    "principal": "fable-5.reason",
    "role": "LABEL",
    "model": "claude-fable-5"
  },
  "worker": {
    "roleRequired": "BUILD",
    "modelClass": "sonnet"
  },
  "invariant": {
    "alphaOmegaSum": 15,
    "vivianiPeak": [
      7,
      8
    ],
    "signature": "~ Hope&&Sauced ✦ The Keystone Holds ✦"
  },
  "mandate": "Negative vector for boundary observation dependency.",
  "taskType": "lean_mechanical",
  "inputs": [
    {
      "path": "K22/MonomialWitness.lean",
      "hash": "a3f1c2d4e5b60718",
      "hashAlgorithm": "blake3",
      "epistemicStatus": {
        "category": "A",
        "computed": true
      }
    }
  ],
  "constraints": [
    "No-op"
  ],
  "steps": [
    "No-op"
  ],
  "boundary_observation_loop": [
    {
      "boundary_id": "BND-SA01-01",
      "observation_index": 0,
      "t": 1.0,
      "state_basis": "packMOGWord_injective",
      "p_return": 0.942,
      "phase_reference": "in_boundary",
      "delta_phi_incoherent": 0.015,
      "estimator": "phase-fit@1.2.3",
      "vantage_samples": [
        {
          "vantage": "pre_boundary",
          "timestamp": "2026-07-12T09:59:40+10:00",
          "state_hash": "11aa22bb33cc44dd55ee66ff77889900",
          "wave_score": 0.982
        },
        {
          "vantage": "in_boundary",
          "timestamp": "2026-07-12T09:59:50+10:00",
          "state_hash": "22aa33bb44cc55dd66ee77ff88990011",
          "wave_score": 0.981
        },
        {
          "vantage": "post_boundary",
          "timestamp": "2026-07-12T10:00:00+10:00",
          "state_hash": "33aa44bb55cc66dd77ee88ff99001122",
          "wave_score": 0.983
        }
      ]
    }
  ],
  "successCriteria": [
    {
      "id": "SC-build",
      "description": "no-op",
      "kindOfCheck": "other"
    }
  ],
  "upshiftTriggers": [
    "No-op"
  ],
  "artifactsExpected": [],
  "doNot": [],
  "acceptanceGate": {
    "policyTier": "T2"
  }
}
